{
  "$schema": "https://json-schema.org/draft/2020-12/schema",
  "$id": "https://fabio-ara.github.io/AraLearn/authoring/schemas/repair.schema.json",
  "title": "Pedido de reparo",
  "type": "object",
  "required": ["artifact", "version", "runId", "partKey", "targetSha256", "issues"],
  "properties": {
    "artifact": { "const": "aralearn.repair" },
    "version": { "const": 1 },
    "runId": { "$ref": "common.schema.json#/$defs/uuid" },
    "partKey": { "$ref": "common.schema.json#/$defs/partKey" },
    "targetSha256": { "$ref": "common.schema.json#/$defs/hash" },
    "issues": {
      "type": "array",
      "minItems": 1,
      "items": {
        "type": "object",
        "required": ["issueId", "pointer", "observed", "requiredChange", "preserveFields", "acceptanceTest"],
        "properties": {
          "issueId": { "$ref": "common.schema.json#/$defs/identifier" },
          "pointer": { "type": "string", "minLength": 1, "pattern": "^/" },
          "observed": { "$ref": "common.schema.json#/$defs/nonEmptyText" },
          "requiredChange": { "$ref": "common.schema.json#/$defs/nonEmptyText" },
          "preserveFields": {
            "type": "array",
            "minItems": 1,
            "items": { "type": "string", "minLength": 1, "pattern": "^/" },
            "uniqueItems": true
          },
          "acceptanceTest": { "$ref": "common.schema.json#/$defs/nonEmptyText" }
        },
        "additionalProperties": false
      }
    }
  },
  "additionalProperties": false
}
