{
  "artifact": "aralearn.repair",
  "version": 1,
  "runId": "11111111-1111-4111-8111-111111111111",
  "partKey": "part-conjuncao",
  "targetSha256": "cccccccccccccccccccccccccccccccccccccccccccccccccccccccccccccccc",
  "issues": [
    {
      "issueId": "repair-feedback",
      "pointer": "/fragment/microsequences/0/cards/1/after",
      "observed": "O feedback apenas repete a alternativa correta.",
      "requiredChange": "Explicar por que uma única proposição verdadeira não basta.",
      "preserveFields": [
        "/fragment/microsequences/0/cards/1/id",
        "/fragment/microsequences/0/cards/1/position",
        "/fragment/microsequences/0/cards/1/options",
        "/fragment/microsequences/0/cards/1/answer"
      ],
      "acceptanceTest": "O feedback menciona a exigência de P e Q verdadeiras e diferencia os dois distratores."
    }
  ]
}
